{
  "definitions": {},
  "$schema": "http://json-schema.org/draft-07/schema#",
  "type": "object",
  "required": ["ingredients", "steps", "name"],
  "properties": {
    "name": {
      "type": "string"
    },
    "rating": {
      "type": "number",
      "format": "int32"
    },
    "notes": {
      "type": "array",
      "items": {
        "type": "string"
      }
    },
    "source": {
      "type": "string",
      "format": "url"
    },
    "ingredients": {
      "type": "array",
      "items": {
        "type": "object",
        "required": ["ingredient", "quantity"],
        "properties": {
          "ingredient": {
            "type": "string"
          },
          "quantity": {
            "type": "string"
          }
        }
      }
    },
    "steps": {
      "type": "array",
      "items": {
        "type": "string"
      }
    }
  }
}
